{"artifact_status":"test-only","chain_manifest_digest":"sha256:697d744efa4205af192754d15d1c0fd4057180c4c7d01ad25e3c89e4a4dabab0","chain_tree_digest":"sha256:03064226e9cce6a533abd565d0eda09cd7b8ce130ffd41edeaf5d93472005ad4","generated_at":"2026-08-03T00:00:00Z","latest_revision":2,"latest_status_set_digest":"sha256:e8fc3b352278b4443a516e27b578380642b773353a7f84d2ddf35bc626845ae1","limitations":["The verifier cannot prove that a supplied offline status chain is the globally latest distributed revision."],"record_type":"public-release-status-chain-manifest","revisions":[{"generated_at":"2026-08-01T00:00:00Z","previous_status_set_digest":null,"revision":1,"status_set_digest":"sha256:ad7b523b1d0d48b1579c2090677e4eb9018cb62e5c8c4b7e14e4777a2b83397a","status_set_file_digest":"sha256:58f1e964cd3cdc88cbb450228b31d27e9221531ff8a7aed5b84b5bc45085cbc2","status_set_path":"revisions/0001/public-release-status-set.v0.1.json","status_signature_digest":"sha256:7ff72d054749fdebe9d319c3ae0fc71aa9bad02b462d718c93528e63d0af46f7","status_signature_path":"revisions/0001/public-release-status-set.dsse.v0.1.json"},{"generated_at":"2026-08-03T00:00:00Z","previous_status_set_digest":"sha256:ad7b523b1d0d48b1579c2090677e4eb9018cb62e5c8c4b7e14e4777a2b83397a","revision":2,"status_set_digest":"sha256:e8fc3b352278b4443a516e27b578380642b773353a7f84d2ddf35bc626845ae1","status_set_file_digest":"sha256:7a4fa68d70f7a94dcc2505523e54574c15009510ed3e856480f92edea49e0d4b","status_set_path":"revisions/0002/public-release-status-set.v0.1.json","status_signature_digest":"sha256:e258ca71445f4b137b475ff4f90241f2e040488070525c417735db0c6c022167","status_signature_path":"revisions/0002/public-release-status-set.dsse.v0.1.json"}],"schema_version":"0.1","status_signing_key_id":"sha256:deb2ded39dc26fce0e6085b6fc34bf6b5941913bbfe2ea614113cff9e004c170","status_signing_profile":{"algorithm":"ed25519-rfc8032","id":"private-match-public-release-signing","payload_type":"application/vnd.itdo.private-match.assurance-release-status-set.v0.1+json","version":"0.1"},"trust_domain_id":"itdo-private-match-assurance-fixture-v0.1"}