{"artifact_status":"test-only","chain_manifest_digest":"sha256:032d19e351e37aa83b37a79a8433baf977fc2ecf2ff7b5806ff290c67438ab68","chain_tree_digest":"sha256:14d2f20f2cfed17f51dbd6a2f75a6c9c73d1d6343b31003e3e7f8e144af6c890","generated_at":"2026-08-03T00:00:00Z","latest_revision":2,"latest_status_set_digest":"sha256:4b91404912c21d3e980cc497d68f5fd84c2e808ee9f2018e66dd1b2fea98980d","limitations":["The verifier cannot prove that a supplied offline status chain is the globally latest distributed revision."],"record_type":"public-release-status-chain-manifest","revisions":[{"generated_at":"2026-08-01T00:00:00Z","previous_status_set_digest":null,"revision":1,"status_set_digest":"sha256:ad7b523b1d0d48b1579c2090677e4eb9018cb62e5c8c4b7e14e4777a2b83397a","status_set_file_digest":"sha256:58f1e964cd3cdc88cbb450228b31d27e9221531ff8a7aed5b84b5bc45085cbc2","status_set_path":"revisions/0001/public-release-status-set.v0.1.json","status_signature_digest":"sha256:7ff72d054749fdebe9d319c3ae0fc71aa9bad02b462d718c93528e63d0af46f7","status_signature_path":"revisions/0001/public-release-status-set.dsse.v0.1.json"},{"generated_at":"2026-08-03T00:00:00Z","previous_status_set_digest":"sha256:ad7b523b1d0d48b1579c2090677e4eb9018cb62e5c8c4b7e14e4777a2b83397a","revision":2,"status_set_digest":"sha256:4b91404912c21d3e980cc497d68f5fd84c2e808ee9f2018e66dd1b2fea98980d","status_set_file_digest":"sha256:60f9ddd1646ce8ed6a0ce3148755274529e5feb973c3cb6b3542fe7d572438fa","status_set_path":"revisions/0002/public-release-status-set.v0.1.json","status_signature_digest":"sha256:cb42e0e2e17f0585501b73721fada8e209495942b5ce9846b2090f4178c55b02","status_signature_path":"revisions/0002/public-release-status-set.dsse.v0.1.json"}],"schema_version":"0.1","status_signing_key_id":"sha256:deb2ded39dc26fce0e6085b6fc34bf6b5941913bbfe2ea614113cff9e004c170","status_signing_profile":{"algorithm":"ed25519-rfc8032","id":"private-match-public-release-signing","payload_type":"application/vnd.itdo.private-match.assurance-release-status-set.v0.1+json","version":"0.1"},"trust_domain_id":"itdo-private-match-assurance-fixture-v0.1"}