{"artifact_status":"test-only","chain_manifest_digest":"sha256:735ac652eb6be61078c7541d72353db9e8722e5893086c8674f8dda5d0e76406","chain_tree_digest":"sha256:425638d130568fea370c16e57a09dfabc1091f0f800008be62772f0e55fc3d1e","generated_at":"2026-08-03T00:00:00Z","latest_revision":2,"latest_status_set_digest":"sha256:3adee1f38963a556fba32035b186aa2aad59ae4ae1621fdaaa06ab6b632a23c4","limitations":["The verifier cannot prove that a supplied offline status chain is the globally latest distributed revision."],"record_type":"public-release-status-chain-manifest","revisions":[{"generated_at":"2026-08-01T00:00:00Z","previous_status_set_digest":null,"revision":1,"status_set_digest":"sha256:ed974aa8fcd901928740b0875807411e7218c131b8d4d1cca20e7dde3efe6074","status_set_file_digest":"sha256:a8c51ada0ecfb01b1d73833fcbc216e8405460754d51f1b6bf431ff92af06fb7","status_set_path":"revisions/0001/public-release-status-set.v0.1.json","status_signature_digest":"sha256:12879b1a9facf3ab4c64965713e8af9aa88d6165b11a2ee897578f976347f0bc","status_signature_path":"revisions/0001/public-release-status-set.dsse.v0.1.json"},{"generated_at":"2026-08-03T00:00:00Z","previous_status_set_digest":"sha256:ed974aa8fcd901928740b0875807411e7218c131b8d4d1cca20e7dde3efe6074","revision":2,"status_set_digest":"sha256:3adee1f38963a556fba32035b186aa2aad59ae4ae1621fdaaa06ab6b632a23c4","status_set_file_digest":"sha256:57456e492a91038835d46adba42cd6b600c5178de065021849e345f1be3b582e","status_set_path":"revisions/0002/public-release-status-set.v0.1.json","status_signature_digest":"sha256:93a67d1e50f4c2c0900e0c4a982dbfa6cf4e073fa7bdabf68a0b303cc3f0b4a6","status_signature_path":"revisions/0002/public-release-status-set.dsse.v0.1.json"}],"schema_version":"0.1","status_signing_key_id":"sha256:deb2ded39dc26fce0e6085b6fc34bf6b5941913bbfe2ea614113cff9e004c170","status_signing_profile":{"algorithm":"ed25519-rfc8032","id":"private-match-public-release-signing","payload_type":"application/vnd.itdo.private-match.assurance-release-status-set.v0.1+json","version":"0.1"},"trust_domain_id":"itdo-private-match-assurance-fixture-v0.1"}