{"artifact_status":"test-only","chain_manifest_digest":"sha256:bbdd1b47bea1bcb0b4177ea84fa2e00ce3e0f1a51a2615b0300783bf98b267b2","chain_tree_digest":"sha256:a1a08801967a2839ea5f1bc3be68d7249fd9c7226bc86761f56fcb2f2a372275","generated_at":"2026-08-03T00:00:00Z","latest_revision":2,"latest_status_set_digest":"sha256:4e34c399e045dedea9e70686ab6f56b12f31ad4bea80b53645f9d78d301c3a7b","limitations":["The verifier cannot prove that a supplied offline status chain is the globally latest distributed revision."],"record_type":"public-release-status-chain-manifest","revisions":[{"generated_at":"2026-08-01T00:00:00Z","previous_status_set_digest":null,"revision":1,"status_set_digest":"sha256:dafdc1e6d987d754efc430b995d6706f7e98b89f2f537f1f70310108f7e458bd","status_set_file_digest":"sha256:444667a1b607a6f50a72aa116e70df59c754e4148e3cc6f4e2796021a062d5ba","status_set_path":"revisions/0001/public-release-status-set.v0.1.json","status_signature_digest":"sha256:3545379b463d9d46f85ce0325872189983e50ba536274133e3cf9f95a8560f30","status_signature_path":"revisions/0001/public-release-status-set.dsse.v0.1.json"},{"generated_at":"2026-08-03T00:00:00Z","previous_status_set_digest":"sha256:dafdc1e6d987d754efc430b995d6706f7e98b89f2f537f1f70310108f7e458bd","revision":2,"status_set_digest":"sha256:4e34c399e045dedea9e70686ab6f56b12f31ad4bea80b53645f9d78d301c3a7b","status_set_file_digest":"sha256:29d32920b742fb3546a75b5bb7b48930c9e4f914bad514e7b881359ff130408d","status_set_path":"revisions/0002/public-release-status-set.v0.1.json","status_signature_digest":"sha256:458072ef79c10e2e855e3a13e46af68e187613dc13755a0f5593df415e27f696","status_signature_path":"revisions/0002/public-release-status-set.dsse.v0.1.json"}],"schema_version":"0.1","status_signing_key_id":"sha256:deb2ded39dc26fce0e6085b6fc34bf6b5941913bbfe2ea614113cff9e004c170","status_signing_profile":{"algorithm":"ed25519-rfc8032","id":"private-match-public-release-signing","payload_type":"application/vnd.itdo.private-match.assurance-release-status-set.v0.1+json","version":"0.1"},"trust_domain_id":"itdo-private-match-assurance-fixture-v0.1"}