{"artifact_status":"test-only","chain_manifest_digest":"sha256:c56c52950a2230b8e533f45a67a82428514ea1f4a2aa7829bb79d0c3752bf362","chain_tree_digest":"sha256:fefe0b624b2abaf9c920f8ec73320ff9c18a0d811ef00423675f63880218055e","generated_at":"2026-08-03T00:00:00Z","latest_revision":2,"latest_status_set_digest":"sha256:fa2818d2bfc53ace4637da4bebc844330a5ab9548834d74c83206fcc53abab3d","limitations":["The verifier cannot prove that a supplied offline status chain is the globally latest distributed revision."],"record_type":"public-release-status-chain-manifest","revisions":[{"generated_at":"2026-08-01T00:00:00Z","previous_status_set_digest":null,"revision":1,"status_set_digest":"sha256:dafdc1e6d987d754efc430b995d6706f7e98b89f2f537f1f70310108f7e458bd","status_set_file_digest":"sha256:444667a1b607a6f50a72aa116e70df59c754e4148e3cc6f4e2796021a062d5ba","status_set_path":"revisions/0001/public-release-status-set.v0.1.json","status_signature_digest":"sha256:3545379b463d9d46f85ce0325872189983e50ba536274133e3cf9f95a8560f30","status_signature_path":"revisions/0001/public-release-status-set.dsse.v0.1.json"},{"generated_at":"2026-08-03T00:00:00Z","previous_status_set_digest":"sha256:dafdc1e6d987d754efc430b995d6706f7e98b89f2f537f1f70310108f7e458bd","revision":2,"status_set_digest":"sha256:fa2818d2bfc53ace4637da4bebc844330a5ab9548834d74c83206fcc53abab3d","status_set_file_digest":"sha256:4dd729339230d84d7e0713b09e60ca7b80d06254303794b205cfe57ba4ca504a","status_set_path":"revisions/0002/public-release-status-set.v0.1.json","status_signature_digest":"sha256:37ba008cfb78d058ac0d20a7bcea6b88e1ed2139e516f9a4e87ae0ff8509dcf1","status_signature_path":"revisions/0002/public-release-status-set.dsse.v0.1.json"}],"schema_version":"0.1","status_signing_key_id":"sha256:deb2ded39dc26fce0e6085b6fc34bf6b5941913bbfe2ea614113cff9e004c170","status_signing_profile":{"algorithm":"ed25519-rfc8032","id":"private-match-public-release-signing","payload_type":"application/vnd.itdo.private-match.assurance-release-status-set.v0.1+json","version":"0.1"},"trust_domain_id":"itdo-private-match-assurance-fixture-v0.1"}